Interview,Recommendation,Interview Quotes,Abstracts
1,1,"Amazon sometimes has some agreements, which I think now that the Federal Institute is doing, that it makes this student accounts available that they could test it for a period.","Cloud service companies such as AWS, through a contract with an educational institution, can provide the computing resource for the student's use."
3,1,"Most of these tools have free layers, in the case of Cloud providers. All three of the main ones have an education-oriented version, and that is very good. This for the teacher is a very great facilitator.",All three main cloud providers have an education-oriented version.
4,1,"I recommend [...] Moving all teaching to a cloud. [...] contact AWS. They have a student program, or Google, with Ali Baba, Azure, and IBM Cloud.","Use student program cloud services like AWS, Google, Azure or IBM Cloud to eliminate hardware and network limitation for students."
7,1,"There were times when I combined a set of free services to be used, Heroku. I combined some free services to run these things. I already had a partnership to use closed [...] there is Red Hat Academy, right, where you can use OpenShift and everything else in the context of the effort you want to make. So, this kind of thing helps a lot.",Use private cloud services through academia-industry partnerships such as Red Hat Academy.
12,1,"They have a real experience with respect to Amazon, it's pretty simple, and you can get a free Amazon, you just have to register. ",Amazon cloud provider has a free plan helpful to students.
1,2,"Set up scenarios that they can run on their computer.

Sometimes give up certain things you would like to teach [...] to the detriment of the student not having the ability to perform.

Solutions that the student can run on his computer. [...] adapt to something perhaps with less computational demand.","Build scenarios that students can run on their own computer.

Give up teaching content that the student cannot run on their machine.

Take advantage of the student's own computational resource and adapt to something that requires less computational demand."
1,4,This was somehow harmonized.,Define what are the devops concepts.
1,5,"You can't evaluate with proof; you have to assess with projects with some activity.

With some practical activity.","You can't assess students' DevOps learning with a test, it's necessary to assess with projects, with some kind of hands-on activity.

DevOps teaching with practical activities."
2,5,"Taking a test, simply evaluating him, is even a way of doing this, but in this more practical approach, I believe that the student is better prepared and we are able to evaluate, in fact, the most important aspects of his education [.. .] If he is really acquiring that knowledge, what we really wanted to convey in that particular topic, in that particular subject.",Prefer practical assessments to written tests in order to verify student learning on the subject.
3,5,"We have adopted project-based assessment a lot [...] the assessment of this project puts a student in his context to test in practice or simulate, in practice, a little of what he saw during classes.",Prefer assessment based on practical projects.
5,5,"From a practical point of view, I simply pass on the exercise.

I think that proof would not be a nice deal, but it would be more or less certification from AWS, for example, from Azure, Google, and that is not the purpose. [...] Taking the test, written, open, I do not like it, I do not like the test model as an assessment, I do not think it is cool, I prefer to work with more practical things.","Evaluate through practical exercises.

The assessment must be practical."
7,5,You propose a practical challenge to solve a problem. I think the students end up learning more.,Evaluate through practical challenges.
1,7,I think a potential candidate is GNS3.,The GNS3 tool is a potential candidate as a tool for teaching DevOps.
1,8,"All the DevOps tooling behind it like [...] the ansible or terraform here, or any of those other flavors of automation and deployment and stuff like that you can use.",Ansible as deployment automation tools can be used in teaching DevOps.
1,9,"For me, the approach, from the point of view of the teaching method, would be based on projects and practical activities throughout the course.

It will always be project-based.

Being able to evaluate the actions has to be a script of practical actions that the student has to carry out, and you will evaluate while that student is doing that there.","Incremental teaching method based on projects and practical activities.

DevOps teaching should be project-based.

Create script for practical devops activities."
2,9,"So, I think it's more fruitful, didactically, pedagogically, teaching in this way, with the most practical approach.",Use a practical approach.
3,9,"Development classes [...] want to understand better the issue of DevOps related to continuous delivery processes or how it translates into practice and into delivery tools and models that streamline application building.

Teach DevOps [...] how it applies in practice.","Teach continuous delivery in a more practical context for development classes, using tools and delivery models.

Teach devops in a practical way by applying it."
5,9,"I cannot see a discipline, a DevOps teaching that is not hands-on [...] That is not getting hands-on and making people at least exercise the tools.",DevOps disciplines should use hands-on activities.
6,9,"There is much technology on the market [...] you cannot cover everything, right? However, at the same time, just giving the concept, I do not think it is enough. So you have to make a choice. I will teach this here.

It needed to be some practical project [...] Not to be just in the theory part.","Teaching must be practical, not just theoretical.

Teaching needs a practical project, not just theoretical teaching."
7,9,"You cannot teach DevOps only in theory. You have to experience it. You have to have practical experimentation for that.

Build this entire journey based on practical, incremental activities or missions that are all correlated so that the lessons learned during these practical activities and revisiting the theory of knowledge can flow into a project that involves a set of decision-making, which also in addition to the subjects theoretically covered in the room.","Teaching devops should be practical, not just theoretical.

Build an incremental teaching journey based on activities and missions, always combining practical activities with theoretical knowledge."
10,9,"I've tried to be very incremental. Um, first teach the value of tests, then write the script to build everything on your desk. You don't need any you're alone. ... Then break it down into several components and build them one by one, then put an Artifactory in the middle. So you have the dependency. ... So you can imagine that each people in the group is like a different team in the world.",Try to be very incremental. Everything on your desk first. Splits into several components. Build them one by one. Start working in group.
1,10,"The practice that should occupy eighty percent of the class there, at least.

The practical discipline has a balance between concept and practice, with the practice being the most important.

The concepts need to be objectively presented, but there is not much discussion about.","The practical part must occupy at least 80% of the class.

Balance the presentation of the concepts and the practicals.

Do not delve so deeply into discussions about the theoretical part of devops."
8,10,"My classes are about an hour lecture. And then the other hour and a half is lab it's hands-on, you know, I give them a concept, let's go do it. And by doing it, that's where it really sticks.",Teach each DevOps concept using one hour lecture followed by one hour and a half lab hands-on.
10,10,"First year I did a lot of concept on the whiteboard, um, and then went to exercise for the students to practice. It's not efficient.

That's why we build a class where we have a ratio of about one hour of classroom concept teaching on the whiteboard or something at three hours where they actually type on the keyboard of practical session. I think that's important. Otherwise they don't see it.","Is not efficient to have more theoretical part than practice part during the course.

One hour of classrom concept teaching and three hours of practical session."
11,10,"So all of us, we covered a bit in really in the course, but also the, I mean, the lectures, but also they practice that in the lab.",Make use of labs and lectures.
1,11,"The strategy we used was to divide the workload in half, divide the workload in half [...] and occupy half of this workload with content that is more suited to the area of networks [...] And half of this with the one with content that has more aptitude for the programming area.",Divide the workload of subjects that are related to networking and programming.
2,11,"I believe that for DevOps, you have this balance [...] if you go to a course, that the focus is more development [...] Taking students there to see the other side [...] See Ops and the guys over there from Ops when you can have the opportunity to see more of the Dev too.",Seeking balance in teaching development and operation.
1,12,"I had to delegate this responsibility to the student.

When you do not have resources in the structure you are linked to, as an institution, you have to delegate that the student really finds his ways.","Delegating the responsibility for finding adequate infrastructure for the student when it is not possible to obtain the necessary resources from the institution.

Delegate responsibility to the student."
2,13,"I like to base it on a textbook because I think a sequence is evident for the students, right? We can even choose some chapters, even making an essential part of this material [...] we research several things to set up our class. Still, having a backbone formed by literature I think it's always important.",Using a textbook as a basis and to give students a better idea of the sequence of the course contents.
12,13," I was looking for books to use. And, um, you know, I started to look at the books from Jane Kim. Um, and essentially I found this DevOps handbook, which has really not written as a textbook, but it's, it covers it's, it's built around the three ways of DevOps. So the first way is the notion of flow. The second way is the notion of, um, feedback. And the third way is continual learning and experimentation.

So this book [DevOps Handbook] is very well done in this sense [...] it goes to the foundations of devops and gets to the different key ideas, right?

The lectures, um, for the first part it's okay. I think for, until the midterm to have just get essentially through the book.

The book has a lot of case study and examples like Facebook, Google, LinkedIn, uh, Netflix.","Take Gene Kim's book DevOps Handbook as a reference to prepare a DevOps class.

Devops Handbook goes to the foundations of DevOps and gets to the different key ideas.

Use DevOps Handbook to create the lectures.

Find books like DevOps Handbook that have industrial case studies about Facebook, Google, etc."
2,14,"There are a [...] series of features to be developed, and [...] the student has been trained for this. But other aspects related more to putting the system into production, to be careful [...] after the procedure is operational, not focusing on factors related to the system's functionalities anymore, but directing to non-functional aspects, then the students they need to have a better sense of it.",Work on improving students' skills related to non-functional requirements.
2,15,"The microservices tool is one of the tools I have been using with them. A device, an environment in which we put the students' solutions there and they can see more of the Continuous Integration part there.

These systems being made available and then with the creation of the DevOps tool from the IFRN cloud, the microservices system there, it was then possible for us to have this more practical view of the process as a whole. So, I have adopted it in all semesters, including, I have always asked students to work with this tool.

Having this system already in the air, I also believe that it is another gain, why? Because as you advance in the themes, you can already put look, this aspect here that we are working on, you will have already contemplated in the system through this, this and this.","Use of a learning tool to facilitate understanding of the concept of Continuous Integration.

Using a learning tool helps in DevOps teaching.

Using a learning tool helps in DevOps teaching."
6,15,"When it comes to teaching devops concepts, like, continuous integration, there will be a tool.",Use tools while explaining the continuous integration concept.
2,16,"The importance of actually having a discipline like this in the curriculum talking about these themes.

We are going through a matrix reformulation process,[...] this part of the workload and this discipline, really, the usefulness and one of the defenses that were made, was precisely that the discipline existed in the course, precisely because at another time, these topics would not be considered. So that's why it's important to have a discipline like that in the curriculum talking about these themes.

In a course like ours, in development, having a discipline like this, I think it is important indeed.
","DevOps deserves a discipline in the curriculum.

Be concerned with the course's curriculum, maintaining and creating DevOps disciplines.

DevOps deserves a discipline in the curriculum of courses focused on software development."
2,17,"We can assess teamwork in students, like those who are collaborating, those who are more overloaded, those who are perhaps less overloaded, those who develop and deliver more features, those who do not cooperate with teamwork.",Evaluate level of participation and difficulty of students in teamwork.
6,17,"The evaluation part [...] the recommendation would be to try to come up [...] some project or some challenge in the project itself that involves collaboration between people. Be able to divide the class there, the students into groups and each one will attack a problem and then everything has to come together, right? So, watch them.","Assess students through project and group exercises, more specifically the collaboration of each one within the group."
2,18,We can monitor this part of the evaluation a lot due to their activity. So part of it is the cloud system tool that allows us to do this monitoring.,Monitoring of students through activities in a learning support environment.
2,19,"Usually, they already arrive with the system, sometimes deployed in another environment, which is quite common for them to use this environment. Then we have to bring them in, asking them to use ours.",Ask students to adopt the tools used by instructors.
2,20,"Suppose the course is a development course or one that involves the operation part. In that case, it is essential to have a discipline that centralizes this information, a domain, perhaps, later on, that gathers these concepts, already preparing the student more for the market.[...] a rather considerable workload to have this dynamic with the students.",A discipline must have a considerable workload to centralize and harmonize development and operation information.
2,21,"They use the system, and I always ask them to socialize. Now, of more remote education, we're doing that they associate what they did.  And when we are at this moment of socialization, the students can take advantage of the gain and knowledge that another team had in an aspect that, at times, they had not noticed.",Socializing knowledge acquired in practical activities is essential for learning.
8,21," I teach them about social coding.

It's tough to get the students to be more social if you will, in their coding practices and do pair programming, uh, and follow the, get feature branch workflow. ","Teach social coding.

Get the students to be more social in their coding practices and do pair programming."
2,22,"They choose to [...] put this system on the air for a customer to see, right? In this aspect, the client is the teachers themselves who are evaluating.",Adopt a more professional approach in which teachers act as clients.
2,23,"The aspects that we address about continuous integration, [...] use of the tools we use in the environment, on a day-to-day basis, facilitate development that speeds up delivery; this is one of the topics we have. In the discipline, I believe that these themes should be part of their curriculum; they should contact this theme there.",The Continuous Integration and industry tools must be in the curricula.
2,24,"But as there isn't, we find different materials; we have several publications.","Combine the various materials and publications available to make up for the lack of a unified, complete, and high-level material."
2,25,"[...] With the addition of our Project of Software Development team of professor Sales, he has access, so, more within the tool, he already knows the most diverse aspects. It was already possible for us to solve several difficulties.[...]","When using a tool to help teach, you must have a good command of it and the necessary permissions/accompaniment of someone with such permissions to deal well with the possible difficulties during its use in the discipline."
3,26,The same DevOps discipline now applies at the institution where I teach concerning classes focused on security and vulnerability management and courses focused on application development and construction.,You can use the same discipline of DevOps for operation groups focused on safety and development groups.
3,27,"In DevOps [...], the security teams are much more in understanding what it represents from the point of view of vulnerability management and architecture, from the network concerning the cloud.","Teach the part of cloud vulnerability, architecture, and network management to the security classes in DevOps."
3,29,"The recommendation is to understand the learning context of the class.

Adapt the menu according to the student profile you have.","Identify the most compatible DevOps scope for each class.

Adapt the course according to the profile of students."
3,30,"Having a unique mechanism and an initial step, the final step you want to reach within this test, makes it much easier when you teach, when you do, especially for examples.

Explain how the methodology can be applied, with examples and even tools.","Make an example to the student in a practical context from the initial stage to the final step.

During the explanation of how to apply devops methodology, make use of example including tools."
4,30,I am not going to deliver a ready-made recipe. I am going to use different tools. diverse methodologies that are also tools for them to try to apply within their process.,Use different tools and methodologies.
11,30,"The lab is like in the lab, because it's a very practical ...   we've implemented an application, uh, a web application, which, uh, in, currently we are using the application we use is a banking application. It is the online banking where people can go in and create an account or transfer between accounts and do all those kind of thing.",Provide sample application in the labs.
12,30,"In some topics, maybe it's introducing a bit more. So say that you're getting in the topic in the, in the lecture where, um, containers are, are relevant and then deployment is relevant. Then maybe the way is to discuss a bit more maybe than use Kubernetes and Docker, give concrete examples and stuff like that that supports the reading that they have done.",Show concrete examples when you are presenting some tool like Kubernetes and Docker.
3,32,"Present concepts that are well established in the community, such as axes, [...] in the DevOps process.","Introduce well-established concepts by the DevOps community, such as the DevOps pipeline process."
9,32,I simply want them to be able to set up some kind of a pipeline and understand how it works.,Teach how to set up a pipeline and explain how it works.
3,33,"Present [...] cases on how this translates, [...] eliminating the silos between operations and development.

Identify the scenarios, Google's case. At Google, they have a solid concept of DevOps and the idea of the role of, for example, the SRE professional in terms of environment resilience within the DevOps framework.","Present the use case of devops, for example, the elimination of silos among the development team.

Identify the market use cases of devops such as the Google case and the relationship between DevOps and the SRE professional to illustrate the importance of DevOps concepts."
12,33,"The students were still very satisfied with the course [...] we built on the labs of last summer, but may that kind of a case study kind of fixtures case study and the students pretty much like it.

The lectures are more the, you know, sharing the experience and, and zooming in and some of the concepts.","Try to use case study together labs.

Use lectures to show case studies and emphasize in some of the DevOps concepts."
3,34,Always start with culture before moving on to teaching or tool-based demonstration.,Start teaching DevOps from the culture. Only then demonstrate with tools.
3,35,"Build a cohesive [...] laboratory in a specific setting that can better demonstrate the concept being taught there.

So, the recommendation is to abuse the use of online solutions, which facilitate this process, but at the same time, stop the journey [...] So, the recommendation is to abuse the use of online solutions, which facilitate this process, but at the same time, stop the journey.","Delimit a specific set of tools to build a scenario in order to demonstrate a concept to be taught.

Standardize the use of tools in a well-defined setting."
3,36,"If it's a case where I don't have access to almost anything, I need to go to a cloud to take a class with the student, even if it doesn't involve the course itself. I need to do everything remote.","For a scenario with limited resources, it is recommended to make use of public cloud services."
7,36,"Everyone is already using Google or Amazon, with their Kubernetes environments available for you to use.","Use available cloud services (AWS, Google) with Kubernetes."
8,36,The environment setup is key. What I would love to do is have an environment in the cloud. That's always consistent. That would kind of be the best.,Do environment setup in the cloud is the best option because they are always consistent.
9,36,"The recommendation is we just get them off their local machines and get them working off cloud servers or something like that. So that at least a, you can kind of script the stuff be if it gets messed up, there's no risk. You just tear it down and build a new one.",Get students off their local machines and get them working off cloud servers.
12,36,"The third lab, that's what we do since last winter. We didn't do it last summer, did deploy on, on, on AWS. So we have, we have built accounts on Amazon, so they can go all the way.",Make the students experiment how to use a cloud provider like AWS.
14,36,"I think maybe the, um, the using external cloud services would give you the better in terms of DevOps philosophy, let's say, because then you're really pushing and you bring stuff outside of the academy ecosystem.","Using external cloud services would give you the better in terms of DevOps philosophy, because then you're really pushing and you bring stuff outside of the academy ecosystem."
3,37,Put the student in an efficient context: he can see in class a tool that he has probably seen someone using in the company or has heard of. This makes for much better immersion in class.,"Search for references from practical contexts experienced by students to easy the understanding, using popular tools."
4,37,"So, suppose someone had a more traumatic experience at such a stage of the delivery process. In that case, you know how to use it at the right time with them and impersonate with them, talk, look, as you told me in that part, a solution that might work for you, again, because there is no ready-made solution, it would be to apply this technology to try to mitigate or resolve it.

I prefer to take it out during class to show the day-to-day blocks delivered in the end. However, the recommendation is to use the infrastructure blocks to feed your course, as didactics. Do you speak, look, remember the block we had? The dependency, the software is made in Java 8, and we tried to compile a machine that had Java 15. Do you see this problem? How do we solve it? We analyze, run some process analysis frameworks because we can use any language as a tool, but use it as an experience.","During the explanations, make use of the difficulties, opinions and experiences faced by the students, pointing out solutions using Devops.

Use the difficulties with infrastructure in favor of learning, conducting discussions among students."
11,37,I spent a couple of discussing about the concepts discussing about the issues.,Promotes discussions about DevOps concepts and related issues.
3,38,"This menu will have some possibilities to create mutations in this menu because the DevOps concept is very open; right, it encompasses different areas between development, security, and operations.","Create mutations in the menu due to the breadth of DevOps encompassing the development, operation, and security part."
