Interview,Recommendation,Interview Quotes,Abstracts
3,39,"This curriculum, a part of it, do you understand? With about forty percent, about sixty percent fixed, which is culture, main historical characteristics of how it came about, what does culture represent, what it changes about development processes, security operations. The changeable part is the tools, where you will apply them or what matches you to the students within the classroom in the course syllabus.",Half of the curriculum with DevOps concepts/culture. Half the curriculum with tools.
3,40,"For a project management class [...], I often had to introduce [...] based on direct analogies or analogies with other scenarios he has already encountered in the product management part to understand what I was speaking.","For project management class, it is necessary to introduce DevOps through direct analogies or using scenarios known to them during teaching."
3,41,"Always focus on culture, the tools are excellent, they attract a student, they create a practical scenario, but oh, DevOps implementation errors in practice are mainly caused by companies and professionals who do not interpret this as a culture.

More important [...] is to understand that concepts such as observability, development culture, communication, sharing are core. They are the core of what is proposed in relation to DevOps.","Emphasize the importance of the DevOps culture and propagate it.

It is important to teach concepts such as observability and other cultural aspects such as sharing and communication."
4,41,"Teach the DevOps culture: respect the individualities of your team, not looking to blame anyone but for solutions.","Teach the DevOps culture: respect the individualities of your team, not looking for blame, but for solutions."
8,41,"The only way to teach culture, the only way to experience culture is to immerse the students in the culture. [...] one of the examples I give to my students is I say, you know, I took three years of Spanish in high school and I don't speak a word of Spanish, but I bet if I spent a summer in Spain, I would come back speaking, fluent Spanish. So I tell them: this class is your summer in Spain, right? We are going to live DevOps. We're going to experience DevOps. And that's the only way you can properly teach it.

Working as an agile team and using the DevOps tools, but most importantly, living the DevOps culture.","Live DevOps and its culture is the best way to learn it.

Living DevOps culture is more important than just learning DevOps tools."
12,41,"Like, what do you teach in a DevOps course? Like, do you teach just technologies like Kubernetes and Docker? And, and I kept saying, no, this is not why I went back to university. I don't want to be just teaching techniques and tools because these will change over time.",Don't teach a DevOps course only focusing on tools and technologies because it changes over time.
4,43,"And DevOps a lot in seeing this; they have different backgrounds, have other life stories, experiences that marked them in different ways and knowing when to present a new tool, listen to what these people have.","We seek a communication between students and teachers, where attention is paid to the students' opinions."
8,43,"So I let them know that if you asked me the same question a second time, I promise I won't answer it the same way. I'll try to find some different way to make that connection with you. Right? So that you understand it, given the background that you have. Given the skills that you have. Uh, so again, I try to immerse them in this culture.",Teaching customized based on students background.
4,44,Nor use VM virtual machines because the virtual machine demands hardware resources. And it's not always that you have availability to upload two virtual machines on the student's device.,"Avoid using virtual machines because they demand hardware resources, which are not always available on the students' devices."
1,45,"All the devops tooling behind it like [...] the ansible or terraform here, or any of those other flavors of automaters and deployment and stuff like that you can use.",Terraform as a deployment automation tool can be used in teaching devops.
4,45,"I am going to upload the environment here on AWS using Terraform. So, provision the students' machines with TerraForm, explain to the students what you are doing, at the right time, on schedule, but decouple the need for the infrastructure.",Use Terraform as a provisioning tool (Infrastructure as Code).
4,46,"To put your hand on something, at least once every, depends a lot [...] on the schedule, but every, I'll put it every eight hours is a very subjective metric, but if you give something practical every eight hours with examples for the student to interact, so you don't stay in a lecture for hours on end talking, it's essential to know how to divide and balance.

He has up to twenty, twenty-five minutes, he has your attention. So, if you cannot break that, alternate the tone of voice you speak, interact with him. If you just talk, you quickly lose the student after twenty minutes.

We need to adapt to the environment and try, every twenty to thirty minutes, to interact with the student so that he does something to keep his attention [...] Always propose challenges.","Use practical examples regularly for the student to interact.

Interact with the student and break the tone of voice every 20 minutes, inhibiting their loss of attention.

Interact with the student to keep him alert, proposing challenges, for example."
4,48,"So, I think it's essential for you to break both the tone of voice, the didactics you're using, put examples, you'll explain something theoretical, like Lean, for example, does an exercise that simulates the Lean process, not in software, it can even be with software, it can be with blocks, use Trello, interact with the student because if you spend more than twenty minutes talking, anyway, any situation, even in a typical lecture, you lose the student, you lose the audience.","Use examples with students to teach theory. For instance, we are using blocks or Trello to teach Lean."
4,49,"Suppose it's a class that, specifically, we were given the needs and characteristics before, such as access limitations, limited software installation on the machine. In that case, I prepare the class, and we have the schedule as a whole, which is ready; it has a beginning, middle, and an end.","Seek to know in advance the needs and limitations of the class, such as installing software, for example, to create a more efficient schedule."
5,49,"If you are going to teach a software build class, for example, or unit testing, you need to assume that your class is in a certain place, let us say. You need to assume that your class is made up of developers, has a bit of knowledge and such, or you need to assume that your class does not have that much experience.","Identify the students' initial level of knowledge to do the course. For example, check if students can run unit tests that will be used in the software build class."
4,51,"If it's a mixed class, we send students a document that shows them beforehand, right? What are the prerequisites for him to take the course, software, software versions, how to install, well documented.",Share course prerequisites with students in advance.
4,52,These are documents that we send in separate stages of the course [...]. We break the infrastructure documents to do the Kaisen process within Lean-to unify the documentation so that the student understands the difficulty he faced and the problem he faces daily.,"Create student support examples and guidelines, breaks into parts to go through the steps gradually."
10,52,"But it's been billed according to the right guidelines that we want them to use. So they can borrow heavily from the sample. They can see sample testifies, sample integration test, sample Docker files, componentization, et cetera.",Create examples and guidelines to help students develop their solution based on it.
12,52,"We're building a couple of tutorials so that, you know, the ones that have less experience with certainly the testing can look at it.",We're building a couple of tutorials so that the ones that have less experience can look at it.
4,53,So we break the infrastructure documents to do the Kaisen process within Lean-to unify the documentation so that the student understands the difficulty he faced and the difficulty he will meet daily.,Simulate real problems that the student will likely face in their daily lives.
11,53,"So we employ someone in our team, a couple of people who work on implementing that, and we created some issues in the application, like some bugs.",Try to simulate a real scenario employing someone in the group to insert issues and bugs in students project.
4,54,"From a didactic point of view, we leave one or two hours before each day; there is a specific infra team to answer any student's doubts.",There is a specific support team to answer students' questions about the related infrastructure part.
4,55,"Realize how much you deviate because the student has a particular problem and loses his didactics a little. So, knowing how to limit it too, then work with the student, talk, look, and talk more calmly, because this situation is particular. There has to be a breakpoint because otherwise, you'll lose the other students.","Avoid messing around with specific problems faced by students, dealing in a personalized way at the right time."
4,56,A task tracking tool. Then it can be Notion or Trello. I think it's essential.,Use a task tracking tool like Trello or Notion.
4,57,"There must always be two tools, the stream that would be the zoom, Google Meet, any device that does that, Webex I don't know, it depends on the company.","Use a streaming tool like Zoom, Google Meet, or Webex in remote learning scenario."
8,57,Because of the remote learning  [...] I've been teaching my classes on zoom.,Use Zoom in remote learning scenario.
4,58,"I prefer Notion even though I work for Trello's company; I prefer Notion for a reason. I can export it in Markdown and directly version all documentation. So, for each day of the course, all the commands that we run or the additional content, I list them, interact with them, and interact together.","The Notion tool allows exporting to Markdown, enabling the versioning of documentation for each day of the course: all executed commands and additional content."
4,59,"And a code repository, you can GitLab, Github, which you can share with students, this situation.",Use a code repository tool like Gitlab or Github.
12,59,"They use GitHub. .. The only thing we really need is that the students give us, uh, access to their accounts.",Use Github with access to students accounts repositories.
13,59,"This course has a very specific structure, which is not usual. Uh, the structure is that, uh, everything. Um, I think you have access to our GitHub repository and everything is, uh, available.

Everything in this course was, uh, was, uh, done through the GitHub repository, there are many issues, there are many pull requests and the discussions between TAs and the students and grading everything is there.","Make public access the content of the course using the GitHub.

Use Github to record grading, pull requests and discussions between teacher assistants and the students."
14,59,"The student had to have the code that goes so git as a version control system, uh, GitHub GitLab, the, we had a Bitbucket on-premise also, uh, deployed inside the school.","Use github, gitlab or bitbucket as version control system tools adopted by the course."
4,60,"We usually use Jenkins as an integration tool because it's open-source, it's everywhere, despite having other devices that do the job even better, but it's spread out, it's ancient.

The software [...] built with Jenkins.","Use a Continuous Integration tool. in particular, Jenkins is open source and very widespread. 

Use Jenkins to do continuous integration."
5,60,"Jenkins, you do not pay anything, you install it on your server, and it has gone.",Use Jenkins.
10,60,"They need Jenkins. So either you tell them to go install Jenkins, or what I've done is I say, Hey, here's a Docker image for Jenkins.

Now I realize every day that I need testing and continuous, I mean, Jenkins is my friend.","Uses Jenkins through a Docker image.

Jenkins can be chosen as DevOps tool."
11,60,"And, and, uh, so in terms of the continuous integration server, and there are many different services available, but can we use Jenkins because it is a, it is free and, and a lot of companies are using, but there are some other options that can be used.",Jenkins can be use as continuous integration tool because it is free and lot of companies use it.
14,60,"Let's go for something that we have more control on, uh, using for tools like Jenkins and and a stuff like Docker or Kubernetes was kind of good in a way to, uh, support the deployment and the, uh, like the building plus deployment stuff.",Use tools like Jenkins to have more control on support the deployment.
4,61,"Notion or Trello [...], you need to have a two-way tool where you and the student interact. Not a Gist, for example, because the Gist, although you can only release it because the student needs to put their feedback there too. [...] There are some tasks that we set up there, a post mortem of the process that fails; I need a feedback tool that the student can also interact with.",Notion and Trello allow student and teacher interaction in two ways. Gist does not allow it.
4,62,"So, I usually recommend it to instructors; I recommend it to students when they share it with me. Decrease the FPF rate of screen sharing because that's a lock. Zoom uses what it can if you don't limit it. So, we restrict ten FPS, for example, so that I don't consume too much of my or the student's CPU because I sometimes have to correct the exercise on his side.","Limit the zoom FPS rate to 10, avoiding excessive student and instructor resource consumption."
4,63,"It would help if you observed each student and, and then, you have to listen a lot, too, what was the difficulty he had and where he arrived. So, then, we do a final assessment per student, but our perception of it. If he did well, if he had a lot of doubt, what was the point that generated the most suspicion for him?

I tell them, I am not going to grade you on what you submit. I'm going to grade you on how you got there because getting there is not the point. It's the journey, right? That's the point. [...] I teach them that every failure is a learning opportunity. If you fail and you learn something, you get credit. It's not a failure because you've learned something, we're here to learn.","Individually assess the student's progress throughout the course.

Grade students based on their learning journey and mistakes, not on what they submit. What's important is how they get there, because every failure is learning opportunity."
8,63,"You can't just grade what they submit. You have to watch how they're working.

For the assessment, as I said, I give them a lot of leeway in the beginning. Um, they can make mistakes on their Kanban board and still get full credit if they know what the mistakes are that they made. However, in later sprints, if they make the same mistakes, then I start taking points off.  So I give them time to learn, uh, so that they feel that they can make a few mistakes, take a few risks, um, and not get penalized for it.","Grade based how the students working their tasks and not only what they are submitting.

For the assessment, the students can make mistakes in the beginning without fear of being penalized."
9,63," If there's problems, I'll tell you where there's problems and you can go fix it, go get it, right. Go, go make it, do what it's supposed to do. You know, because in industry we're, we don't just get a one and done shot. We keep at it until it works. And so I bring that to the table and I think that provides a little less pressure on students.

I tend not to get quite as hyper-focused on right versus wrong answers. ... so treating it as, as more of an assessment of maybe architecture, if you will, or an assessment of approach, as opposed to this is right, this is wrong. Uh, I think that's been fairly well received.","Students can fix their code problems. In industry, we keep coding until it works. It also provides a little less pressure on students.

Do not focus your assessment on right versus wrong answers."
12,63,"So people need to feel comfortable sharing, if they've made a mistake or not thinking that they're gonna have their headquarters. Right. Um, so when talking about that, if students have never worked in the context where, you know, people are blaming each other and stuff, it's difficult to understand I, to, to be concrete. And this is so crucial.",Create an environment that students feel comfortable with sharing about their mistakes and learn how with their teammates.
4,64,"They also assess the course at the end; we send you a link and recommend you do this, consider some topics to take the NPS; I think the NPS is the universal metric for assessment, I don't know if you put it under the puts under the radar, the Net Promoter Score, from zero to ten, where zero to zero to seven is Detractor, eight is passive, nine to ten is promoter based on a set of questions that you cannot induce the student.

When people come in to do this, this, this feedback with the students, understand, the students also talk to a person who is not me, who on the last day, I leave, it is a recommendation I give, I leave the conference to leave the students at ease, talking to this person, they make a mistake during the training and the person got annoyed, and with you inside, they will be a little, a little afraid to expose, although it is also by email.","Evaluate the course, performing an NPS (Net Promoter Score) with students.

Teachers and monitors must not be present at the time of course evaluation by students."
12,64,"You need to get the feedback, you don't get the feedback, right? So, and when we, when the students do the student evaluation, of course don't write much. So it's much easier if you can trigger this question.","Do not try to get feedback before a student assessment, as the student may feel fearful."
4,66,"If possible, record at least one training for an autoscopy at the end. See if you have any language addiction, if there were any process that didn't fit the way you imagined, that would work, because when you're talking and doing, sometimes, there's a detail that it shouldn't.",Record a training for the teacher to assess language addiction and whether the class flowed as planned.
4,67,"Mixing, theoretical and practical [...] is essential.",It is essential to mix the teaching of the theoretical part and the practical part of DevOps.
4,68,"We need to talk about the theoretical part about Lean, which is the Toyota method, Kaisen is also very important, Agile which is significantly linked to the DevOps process.","In the theoretical part of DevOps, Lean, Kaisen, and Agile should be taught."
4,69,"What is practical, from the menu, is to make an end-to-end software, [...] But, end-to-end, and the end, which is monitoring.","Make software from start to finish, going through the DevOps steps to the monitoring step."
4,70,"Software build [...] deliver this to a VM, somehow, in the best way you understand, which is possible in your suite [...] You can provide it with Docker.",Perform continuous delivery through virtual machines or with Docker.
4,71,"The software [...] a monitoring tool, in the end, for you to look at. [...] Look at a Grafana, for example, with Prometheus, which is free software, like that.",Use Grafana and Prometheus as monitoring tools.
4,72,"Of the menu is to make an end-to-end software, to understand the software in its conception. We already deliver this to the student, ready. Because we're not going to create the software from scratch, because the code is already kind of polished, it's a code from a forum in Java, where we have some features that depend on the machine to do the build, so we're going to decouple.",Use a complete example project from places such as a java discussion forum.
4,73,"So, the first thing, uncouple the database connection that is versioned in the source code. You can still version the String os; although it's not the best practice, you don't have to comment out the code to change the environment because TomCat will read it from there. Versioning in a git, using a continuous integration like Jenkins, for example, and a constant deploy, a continuous delivery with, it can be with an Ansible, it can be with any tool you deliver or in a VM or the Cloud.","Carry out the following practical activities during the course: the first step is to decouple the database connection from the system code, then version the code with Git, insert continuous integration with Jenkins, and finish with constant delivery using public cloud services or tools with Ansible."
4,74,"Make it very clear, pedagogically, that I think it involves an exemplary sound configuration so that the student can hear you well, always with the camera open, even if the student doesn't open it, because he can't, but let him see you, that he feels this approach as much as possible.","Provide a comfortable learning environment for the student, such as remote teaching, which requires adequate audio and video equipment."
4,75,"Within the menu, try to avoid making the student dependent on that stack you are teaching. So, if you're going to explain Jenkins, take half an hour to explain the pipeline in another tool, so he can see that it's possible. So he doesn't come out with the recipe ready. As much as we don't deliver it, the student creates a recipe in his head, and it won't fit in all of his daily routines. Then it will generate frustration. So, make it clear, look, can you see what we're doing? We're doing it for that reason, at Jenkins. Today we are going to use Bitbucket, for example, which is how we do it. One, as an example, correct?",Show the student that there are several ways and tools to do the task.
5,75,"They said: teacher, I can do it in such language, I can do it in such a platform, can I do it like this? [...] So, I am not going to say that there were, I do not know, six, seven, different environments, right? That there was, but let us put two or three, right, different ones. So, for us, professors, we are often not proficient in all of these, right? So, then the person will have to clarify a doubt, then you say: man, I don't know. So, you decided to do it there, you kind of jump up, like, you know? The most we can do is try to convey the concepts, right? And when the person has a very big doubt like that, you say, boy, try to explain to me how this technology is there that you are using see if I can at least translate the things that I know, that is it.","Teach in a way that knowledge can be applied in different tools, but not focus on the possible specific problems of each technology."
5,76,"I ask the students to implement a straightforward system, which will serve the entire subject. In this minor system, we're going to have tested; there's going to be built, there's going to be continuous integration, there's going to be deployment, you know?

This part of the system, which I ask them to do to monitor the discipline [...] When you go to configure the tools and such, as you were the one who developed the system, it becomes easier, I believe for you to understand all the automation and such. However, at the same time, I see that the guys have much difficulty in doing it.","Use a simple example system made by students.

Students build their own systems during the course in order to increase their understanding of automation."
5,77,The point is to try to exercise as many tools as possible to provide everyone [...] with a range of things to apply in your daily life when you see the need.,Exercise as many tools as possible.
5,78,"Because you have to have the mentality that you will have to get materials from different sources, right? ... you'll have to resort to gray literature, right, which is this literature from the blog, the medium, the Nubank or Netflix blog, which are sensational articles, but that don't have that scientific rigor, peer review, and such. So, like, I think the DevOps teacher needs to understand that he's in this environment, right?

Material heterogeneity is the biggest challenge [...] you have to set up a class sewing the fonts. So, sometimes, for example, in my integration course, I have to give several concepts, right? For you to talk about continuous integration, you need to talk about version control. You need to talk about build. You need to talk about testing. There are several things that are part of continuous integration, right? So, git-flow is not in the book, you know? Branch, development models, that's not in the book.","Use various sources of DevOps study materials, such as gray literature, blog (medium, Nubank, Netflix).

It is necessary to make use of several sources when creating the course."
7,78,"Most of the references, the most interesting cases that I considered bringing to the room are posts on INFO2, on Metzone, Hacker News, Twitter posts, Airbnb case study, Glitch, Orbitz, and such; other cases of those that are much more interesting than necessarily, books or scientific academic articles.","Information in gray literature is more interesting to illustrate DevOps use cases: posts on INFO2, Metzone, Hacker News, Twitter, Airbnb case studies, Glitch, Orbitz."
