Interview,Recommendation,Interview Quotes,Abstracts
10,118,The thing I've done to try to avoid a little bit of the mess is I want to go gradual. I want to be gradual in the class. So first I teach compilation and testing. Then I teach continuous integration. team A is going to build one piece team B is going to build another piece that depends upon what team is built.,"Teach DevOps giving the content gradually, like first teach compilation and testing, then continuous integration; do not give everything right away so easily."
8,119,"I'll have them run their test cases manually. And then when someone makes a pull request, I'm like, well, you need to clone that, run the test case. [...] And then [.. ] I show them how to [...] automatically run the test cases. [...] And so they write all the test cases. And then, and then I, I teach them about code coverage. I said, it's not about the test passing. If the code coverage go down, then somebody code it without writing a test case, don't merge that pull-request, right? So I'm teaching this whole culture, right? This way of working. [...] Then finally we push it to the cloud. We set up CD pipelines to deploy things in the cloud","Write some tests cases manually, do pull requests, do test automation with CI, write all test cases, teach code coverage. Then finally setup CD pipeline to deploy the application in the cloud."
8,120,"So sometimes a student will say to me: professor, what do I do if another student is like not pulling their weight on the team?, And I say: when you go to a job interview, you're going to be asked the question, tell me about a time when a member of your team wasn't pulling their weight. And what did you do to get them excited and to contribute again, today's the day to go write that story. Today's the data to write the answer to that question.

You need to sit together and experience because if you can't work as a team, you're not gonna make it right out in industry because we want team players. I don't want heroes. I don't want people who saved the day. I want people who mentor each other.","Make the group motivation a responsibility of themselves, students should motivate each other.

Teaching how to students mentor each other is one of the most important things and must be a priority."
8,121,"Do they understand what the cloud is? It'd be great if there was a cloud course before mine, but there isn't.",It'd be great if there was a Cloud course before DevOps course.
10,121,It's an option that we give them the year before too preparing them.,Prepare students with previous courses.
8,122,"so I don't care if you using windows or using Mac or whatever you're using. We're all going to learn a bunch of Linux and we're going to deploy all our stuff, using a bunch of it and use all the tools in a bunch of.",Use Linux operational system.
8,123,"We use Vagrant and VirtualBox. And so I don't care if you using windows or using Mac or whatever you're using.

I selected Vagrant and virtualbox because they're both free. ... so I had to change the class for them to use Docker and VirtualBox. 

They call my repo, Vagrant up and they're up and running. And so that's how I solve that problem. Bigger. It does a very good job of solving that consistent environments for students.","Vagrant and VirtualBox are useful to create consistent development environment.

I selected Vagrant and virtualbox because they're free.

Make environment setup consistent between students using Vagrant."
8,124,I selected Vagrant and virtualbox because they're both free. ... so I had to change the class for them to use Docker and VirtualBox.,I selected docker docker because it is free.
10,124,We build Docker images.,Docker can be chosen as DevOps tool.
14,124,"Let's go for something that we have more control on, uh, using for tools like Jenkins and and a stuff like Docker or Kubernetes was kind of good in a way to, uh, support the deployment and the, uh, like the building plus deployment stuff.

I want to be able to deploy it with containers. So it can be, um, through Kubernetes, it can be through Docker.","Use tools like Docker to have more control on support the deployment.

Use Docker as container deployment tool adopted by the course."
8,125,"We use selenium to, to work on the, uh, on the UI, as a browser.",Use Selenium to automate UI tests.
11,125,We use Selenium for test automation.,Use Selenium for test automation.
8,126,"Students will ask me, can I use a different test suite? Can I use, you know, something different? And I'll say, well, you can, but then it's up to you to figure out how it integrates back into everything.",Students could use other tools non-taught without professor support.
12,126," So it's rather simple that we, we let them, of course use the programming language. They want to develop the application. So, you know, the department, I think traditional were quite open with respect to that in the department. Yes. Java is still used, but students, these days, don't like Java. Um, they prefer Python. They prefer different things. So for us, we don't care, right? The application we give them when we gave them the HVAC application, we give them, uh, I think they have, I should even look myself, but I think we, we created two versions, one, it says Java version.

So we support them to the Travis CI. We support them with a certain number of things, but if they want to choose something else, it's okay. I mean, but you know, they have to understand that we won't necessarily support them.","Do not force students to use a single language like Java.

Give students the freedom to choose other tools they want, but make it clear that these tools will not be supported by teachers during the class"
13,126,"We asked them to choose a tool, uh, on internet and new tool, and then use that tool and show other students how that works. So, uh, we didn't have some predefined, uh, projects.

Just find whatever they want to find and work on whatever they want to work on and let them be free since that was our goal in this course, uh, we let them choose, um, novel technologies, the technologies and the tools that are being used, uh, today and the tools that are being developed today. ","The students choose the tools and the projects freely on internet.

Let the students be free about the used tools and technologies."
14,126,"We decided to let the student choose and said, okay, you have your option and do what you want, but you're responsible of doing it.

It was a graduate course, I started not to, uh, enforce given tools ... I want you to have a version control system that should be git, but git up, gitlab Bitbucket, Bitbucket on premises. ...  you can justify and defend each step of what's happening to your code in the context of devops.","Give the responsibility to the student to chose the system and also the responsibility of what they are doing.

Do not enforce given tools on a graduate course. The students should justify and defend each step of what's happening to their code in the context of devops."
8,127,"   People use an Argo CD to do continuous delivery. They used to be using Jenkins. So do you still teach Jenkins? Do you teach them Argo? Um, so it's a constant, um, improvement on the tools are what tools are popular, what tools are going to get them a job in the industry, right? ",Argo CD is a more current continuous delivery tool than Jenkins.
8,128,"I'm going to watch your Kanban board every week.

 I don't give quizzes because I'm grading them every day, watching their Kanban boards, seeing how they're working, interacting with them on slack. ","Teach Kanban board.

You don't need quizzes if you grade the students continuously watching their Kanban boards."
12,128," I built kind of a fictitious company [...] based on my experience [...]  the students work in groups of three [...]  in the first lab, they have to set up their environment [...] We bring them also to, to build, uh, two small applications that actually extract, um, data from the Kanban, uh, in GitHub using the GitHub APIs, because I want the students to one that very important aspect of DevOps is the continuous improvement. So if you want, you have to apply the same principles to the process that you're applying to your product.

We enforce the usage of, of the, of the Kanban, because it's an important practice in devops to make the work visible and stuff.

Make the students realize that the Kanban has certain information for a certain purpose. Um, if I want to analyze my process, I may extract information from the Kanban that will tell me about, you know, the time that I spent in the development phase or in the, in the review phase and things like that.","Create a fictitious company based on experience for students to practice continuous improvement, creating applications, extracting data from Kanban.

Use Kanban to make the work visible in devops.

Make the students realize that the Kanban has certain information for analyzing the overall process."
8,129,"I actually last semester I prepared something on Sunday. And when I got Wednesday, when we had the class and I went to the cloud, the cloud had changed. [...] we're pushing to the IBM cloud the other night and it said there's an, there's a new update available for the tool. Uh, you know, version two, it may have breaking changes. And I said, timeout, nobody press, yes, everybody press no, because that's not the version I used on the weekend.",Check if the the labs work well always before start the class.
9,129,"I'm usually maybe a couple of weeks out verifying something for an upcoming, an upcoming session.",Verify if labs exercises are working before classes.
10,129,"The second recommendation is update your exercises often. ... you can get everything set up.

So you have to have your stack ready, but you have to update it with the current version of the software that you intend the students to use fairly close to the beginning of the session, if you don't want to be surprised.","Update your exercises often to get everything set up.

Update your exercises frequently."
8,130,"So without having, uh, physically having a technical assistance in the class and I do have TA's on with my zoom and they do help students over slack, uh, to get things going.",Teacher assistence help students over slack managing questions.
13,130,"We had a long Google doc that the students during the lectures and after the lectures, students could add their questions there. And then we, the TAs could answer the questions, uh, in the doc. ",Use Google Docs during the lectures so students could add their questions. Teacher Assistants could answer the questions in the doc.
8,131,"Then I give them two exams. So the team is 40% of their grade. The exams are 60% a midterm that's 30 and a, and a final that's 30.","So the team is 40% of their grade. The exams are 60% a midterm that's 30 and a, and a final that's 30."
8,132,"I try to get the student more engaged.... If they're not having fun, then we're, we're doing it wrong. So, so I'm making sure they're having fun.",Try to get the student having fun in order to keep them engaged.
8,133,"In that assessment, you know, that they're, um, there are 50 multiple choice questions in each exam, no partial credit. Um, and, and so, and I give, and it's an hour, uh, you know, to go do that exam. ...  we're remote now.",50 multiple choice questions in one hour each exam if you are remote.
12,133,"The book I have quiz, uh, again, it could be translated and adjusted, but that's the way to, to test in the exams. ...  one part is exactly quiz questions. So they have multiple choices.

If I was asking you the question and say, give me the three benefits of this thought of this, uh, concept, then it's memorization. But if I give them five, if I give you five choices and they could be between zero and five, that are true statements with respect to this concept, it's not about memorization. It's about understanding.

If the exam is in presence, then I don't care that much if, if they do the control that before, because ultimately they have to understand, I think that these quizzes to me have a specific objective.","Use quiz in the book to test in the exams with multiple choices.

Multiple-choice format questions about DevOps concepts favor the understanding instead of memorization of the students.

Quizzes forces students to understand the concepts."
8,134,"the exams are open book, right? I, I, when I'm in the classroom, they're not open book, but for, for the remote learning, they have to be open book. I just can't enforce it.",Exams in remote class format are with the open book.
9,136,"we had cloud computing, where can easily stand up virtual machines for people and things like that.",Cloud computing make easier to stand up virtual machines.
9,137,"People coming through the programs want to play with technology. That's half the reason we got into this field in the first place, and it's a really fun thing to be able to do, but it's not sufficient. And trying to change that mindset to emphasize more the idea of devops as a means of continuous improvement, as a means of organizational change. As a, to some extent I use this phrase guardedly, but to some extent, a philosophy around how the organization is going to go from concept to implementation, that's a much harder set of skills to pick up.

The global approach made sure the students not associated with devops with a CI/CD pipeline, because in my opinion, it's all about continuous improvement.","Make clear the importance of the DevOps mindset like continuous improvement in constrast to using the tools.

Continuous improvement is a key DevOps concept."
12,137,"This mindset of thinking of continuous improvement is so important, right?  ... the improvement of the daily work is more important than the work itself.

What should I improve to make my process more efficient? So to me, this is the most important thing of DevOps. And, and, and then you do it through automation, automation of, of the deployment process, automation of, of, you know, the testing process automation later of the security, uh, thing and so on.","The mindset of thinking of continuous improvement is so important because the improvement of the daily work is more important than the work itself.

The most importart thing of DevOps is to improve my process continuously through automation of the deployment process."
9,138,"I'm starting to do is to just build out images, for example, that contain everything that I want them to have. Uh, and that way I can tell them to spin up a virtual machine. ",Use imagens that contain everything that the teacher wants to teach to clone virtual machines.
9,139,"I use GitHub and they have options for professors, you know, for academic use, where you can set up these GitHub classrooms. I use those constantly, um, and they work very, very well because again, I can kind of control who gets what I can see, everything I can help individuals through things works great.",Use Github for academic use where you can set up GitHub classrooms.
9,140,"I will pick one, usually one, although I'll usually compare and contrast against a couple of others, something in the around of automated builds.",Compare and contrast the tools before to choice.
9,141,"I try to use cloud providers, you know, kind of cloud SAS providers for that sort of thing, because I don't want people to spend a lot of time getting the stuff stood up.",Use cloud SAS providers to avoid spending a lot of time installations and configurations.
9,142,"I tend to focus on gradle, but I also will link that to say a comparison against Maven and ant to provide some context for how we got here, why we got here",Show the evolution of the tools like exposing from ant and maven to gradle tool in build managment.
9,143,"I'm having conversations with the university about trying to take the devops course and essentially converting it to a three course sequence one for agile, one for kind of the dev part of devops and one for the ops part of devops.",separate the dev and ops part into different courses.
9,144,"And that level of what you're trying to do is to build a business case for why you want that at all. And now you're starting to get a little bit around of the computer science and into around of business and being able to tie those two things together in such a way that you can sell it to an organization that would have to spend resources, people, time, energy, money, building out that kind of a technical pipeline, right? 
 ... you have to somehow sell them on why you should spend your sources doing that versus building a new feature or adding a new product or any one of a number of other competing priorities that the business has.","Teach students to know how to sell DevOps benefits to their directors who are from the business area. For example, pipeline reduce developers work time and save money. You can also build a new feature or add a new product that the business has."
9,145,"I don't think the basic skeleton of the class has really changed significantly, maybe a few places, but over the last two or three years, the, the basic structure, the scaffolding I think has held fairly true where we focus on some devops principles. We focus on concepts. We focus on goals.",The basic skeleton of the class does not change significantly because we focus on concepts and we focus on goals.
9,146,So I try to give folks one or two small projects.,Specify what projects the students will work and provide one or two small projects.
10,146,"We will also build a sample, which is on github. I'll send you the link. If you want. We build a sample that is called a cookie factory. Um, it's, it's a system to handle a cookie factory where you can order cookie pay for them, and you get a shopping cart with cookies, et cetera, right? So it's just a small sample.",Use small projects with students.
12,146,"We have built a little simulator that is quite simple, but that's easy to traverse the whole, essentially the main phases of DevOps.",Use a simple application to walk through all DevOps concepts.
9,147,"I will try to provide, uh, some kind of, of jump-starting as far as people learning at technology. So for example, here's commonly used commands. Here's why you use them. Here's how you use them.",Provide jump-starting examples of commonly used commands of tools.
9,148,"So being a little bit more forgiving, a lot of the tools that we're using are brand new. For many people, getting them all to work together can be particularly challenging. And so making it a little less stressful, uh, can be helpful.","Be a little bit more forgivable, understanding that for some people getting all the brand new technologies to work together can be really hard, so make it less stressful"
9,149,"Our particular curriculum tends to allow out of, some degree of necessity and amount of interest based learning. You know, I care about software architecture. And so that's where I want to focus.",Our curriculum allows some degree of freedom according to the teacher's preferences.
10,150,"We let the students build only one project, one code base, which is evaluated both on the standpoint of the architecture. ... but also from the angle of continuous integration, do they include build plan?",Evaluate the single project of the students on the standpoint of the architecture and also from the angle of continuous integration.
10,151,"So we built a curriculum in just very innovative way, the two classes together, a single project, a single teaching team, but we evaluate on two angles.","Built a curriculum with DevOps and Software Architecture classes together, a single project, a single teaching team, but we evaluate on two angles."
14,151,"The course about, uh, software architecture and DevOps, or we're talking about a different way of architecting software, um, mainly distributed system, because it was easier for the DevOps parts who were triggered challenges was a distributed system.  ... And they had one, one lecture in the morning lecture slash lab and one lecture slash lab in the afternoon. And they were really like Friday was dedicated to DevOps slash uh, architecture.",The courses of software architecture and DevOps taught in the same day.
10,152,"And then another team uses in a 13 deploys to environment that the first team cannot get to because it's a production environment that the coder will not get access to it. So in real life, you have different teams of people that talk only through some channels.",Show the operational constraints to students like coder will not get access to production environment.
10,153,"And then as we go into more concept, like what is Jenkins and what is Artifactory and what is Docker, then we can go back on those things.","Study the tools more when you go into the concepts. For example, deep Docker when you teach containers."
10,154,what helps is to build something that is portable and something that can be broken down into several pieces where one student runs one bit and then another students runs the rest. It's also good because it forces them to work as a group.,Build something that is portable and something that can be broken down into several pieces where one student runs one bit and then another students runs the rest.
10,155,"In this year, if you do that, it's too early and it's going to be too hard for you as a teacher to, to know what's going on. So by forcing the technology stack and telling them.

I mean, they're free to do what they want from a functional standpoint in the project.

But from a tools and technology, we force just on them to avoid too many variation between the groups.","Force students to use technology stack used on course.

It is necessary to give freedom to student develop their functional solution.

We force tools and tecnology and alert them to avoid too many variation between the groups."
11,155,"We use a very specific language. This is to just make it easy. I mean, sometimes we give it a bit too flexible. So right now we use a Java and Javascript because we are targeting web application. But, uh, when we students are implementing, uh, new features, so we give them the flexibility. We say, okay, parents, if you want to implement in Python, you can do it as long as you can wrap it in, uh, integrated in the new code.

We give some kind of rough summary of what the application is supposed to do.","It is important to give flexibility to students to develop their solution although some things are determined.

Give students a rough summary of what their application are supposed to do."
10,156,"Go gradually. Um, so tha t,that was part of my strategy. The other thing is I've built a few, what I called a, um, whiteboard free session. So I go something like every week we have half a day, one hour of, uh, formal teaching. And then two hours exercise and we do that for like three weeks in a row. [...] So I do like three classrooms, one free session inspired by what they fail on and I continue.
",Build whiteboard free sessions inspired by what students have failed and the two hours exercise.
10,157,"We've done live presentation, where they have something that 20 minutes to describe the architecture, to describe their build strategy, that test strategy and demonstrate it on the screen. Um, and that is evaluated by a jury of one representative from the software architecture class and one representative from the DevOps class.","The students have something that 20 minutes to describe the architecture of the project, to describe their build strategy, that test strategy and demonstrate it on the screen. That is evaluated by a jury of one representative from the software architecture class and one representative from the DevOps class."
13,157,"Students have to choose some topic and say, okay, we want to do a presentation on this topic. And that topic can be anything related to DevOps.

Everyone who wanted to present a tool or to do a demo or anything else they could give, uh, get some feedback from other students.","Make students prepare a presentation about topics related to DevOps.

Students can present a tool or do a demo to get some feedback from others during the classes."
10,158," we also do two evaluations, one in the middle and one at the end. So the one in the middle, we call it MVP evaluation. And we tell them, at this point, you should have reached an MVP, which is basically a walking skeleton for your code. We don't care if when you call the API, the only code of the API is return true, or which are 12, but we care that you have the components in place. You can build them independently and they can talk to each other. Right? So at this, we validate that your componentization and your architecture is good even before you start building algorithms and the functional code. Um, so we do that and that's, again, that's to catch early, um, architecture mistakes.
",Use MVP (Minimum viable product) evaluation to validate components of the project. Make an evaluation in the middle and the final course.
10,159,"we also have a lot of evaluation during the exercise. When group after group, where we, we give them flags if week green, yellow, or red, based on where we think they are, uh, regarding the objectives.","Do many evaluations of students project along with the discipline. Use green, yellow or red flags to evaluate the group."
10,160,"we cannot make assumption on what they know. So we're trying to work without any assumption.
",Do not make assumption about the learning level of the students when you have students with different levels.
10,161,We show them Kubernetes.,Kubernetes can be chosen as DevOps tool.
